track_number,title,lyrics
,Por Acaso,"1 Contributor
Por Acaso Lyrics
[Letra de ""Por Acaso""]
[Verso 1]
Não, eu não posso negar
Não adianta disfarçar
Agora você me prensou contra a parede
Eu não passava por aí por acaso, ah
Não, eu não olhava pra você por acaso
[Refrão]
Eu sempre quis você
Se eu não me fiz entender
Não foi por mal, não foi por nada
Nada foi por acaso
[Verso 2]
Tudo que já fizemos juntos
E o que deixamos de fazer
Desaba alta madrugada
E nada faz a menor diferença
Quando a gente pensa no que ainda pode ser
[Refrão]
Se eu não te fiz entender
Que era feliz com você
Não foi por mal
Não foi por nada
Nada foi por acaso
[Ponte]
Da janela do avião eu vejo Porto Alegre
Vejo o futuro em flashback
Meu pai, minha filha, nossa casa
Da janela do avião eu vejo por acaso
O nosso caminho, moinhos de vento
Glória, independência, a nossa redenção
Vejo da janela do avião
[Refrão]
Eu sempre quis voltar
Eu sempre quis você
Um dia eu quis tudo
Tudo estava aqui, por aí
Porto Alegre por acaso"
,Pose,"3 Contributors
Pose Lyrics
“Pose,” seguindo a crítica do álbum sobre a sociedade moderna, mostra a situação terrível dos grandes centros urbanos e áreas industriais. O progresso capitalista pode tanto ajudar no futuro, quanto…
Read More
[Letra de ""Pose""]
[Verso 1]
Vamos passear depois do tiroteio
Vamos dançar num cemitério de automóveis
Colher as flores que nascerem no asfalto
Vamos todo mundo, tudo que se possa imaginar
Vamos duvidar de tudo que é certo
Vamos namorar à luz do pólo petroquímico
Voltar pra casa num navio fantasma
Vamos todo mundo, ninguém pode faltar
Se faltar calor, a gente esquenta
Se ficar pequeno, a gente aumenta
Se não for possível, a gente tenta
Vamos ficar acima, velejar no mar de lama
Se faltar o vento, a gente inventa
Vamos esquecer o dia da semana
Tem que ser agora, anos 90
Vamos remar contra a corrente
Desafinar do coro dos contentes
Se for impossível, se não for importante
Mesmo assim a gente tenta
[Refrão]
Não é pose, não é positivismo
Quanto pior, pior
Não é pose, no passarán
Não passaremos por isso
[Verso 2]
Fora voodoo, ranso, baixo astral
Eu não vou perder meu tempo brincando de ser mal
Não vou viver pra sempre nem morrer a toda hora
Como rasgos pré-fabricados num novo velho blue jeans
Morte anunciada, direitos autorais
Pela TV à cabo uma baleia acaba de nascer
Nascer pode ser uma passagem violenta
O futuro se põe, o passado não se aguenta
Oh, oh-oh, oh, oh-oh
Meninos e engenhos, santa ingenuidade
Santíssima trindade, sexo, drogas, rock and roll
Oh, oh-oh, oh, oh-oh
[Refrão]
É pura pose, faz qualquer coisa (Pois é)
E o pior não é isso
É pura pose, posteridade (É nós)
E o pior não é isso
[Saída]
Vamos passear depois do tiroteio
Vamos dançar num cemitério de automóveis
Vamos duvidar de tudo que é certo
Vamos namorar à luz do pólo petroquímico
Lalarala (Ah, ah)
Lalarala (Ah-ah, ah-ah-ah, ah)
Lalarala (Ah, ah)
Lalarala (Ah-ah, ah-ah-ah, ah)
Laralala
Laralala
Laralala
Laralala
Vamos remar contra a corrente
Desafinar do coro dos contentes
Vamos ficar acima, velejar no mar de lama
Vamos esquecer o dia-a-dia, o dia-a-dia"
,Pose [Acústico MTV],"3 Contributors
Pose [Acústico MTV] Lyrics
Lançada primeiramente no álbum Gessinger, Licks & Maltz, “Pose” é performada no Acústico MTV como um dueto de Humberto Gessinger e sua filha, Clara Gessinger.

Originalmente, a música tinha uma sonoridade…
Read More
[Letra da versão acústica de ""Pose""]
[Verso: Humberto Gessinger,
Clara Gessinger
&
Ambos
]
Vamos passear depois do tiroteio
Vamos dançar num cemitério de automóveis
Colher as flores que nascerem no asfalto
Vamos todo mundo, tudo que se possa imaginar
Vamos duvidar de tudo o que é certo
Vamos namorar à luz do pólo petroquímico
Voltar pra casa num navio fantasma
Vamos todo mundo
,
ninguém pode faltar
Se faltar calor, a gente esquenta
Se ficar pequeno, a gente aumenta
E se não for possível,
a gente tenta
[Refrão: Humberto Gessinger,
Clara Gessinger
&
Ambos
]
Vamos velejar no mar de lama
Se faltar o vento, a gente inventa
Vamos remar contra a corrente
Desafinar o coro dos contentes
La-la-la-la, la-la-la-la-la
La-la-la-la, la-la-la-la-la
Vamos velejar num mar de lama
Se faltar o vento a gente inventa
Vamos remar contra a corrente
Desafinar o coro dos contentes
La-la-la-la, la-la-la-la-la
La-la-la-la, la-la-la-la-la"
,Pra Entender,"1 Contributor
Pra Entender Lyrics
[Letra de ""Pra Entender""]
[Verso 1]
Pra entender basta um tapa num cigarro
Uma olhada no mapa do Brasil
Uma caminhada por qualquer caminho
Um carinho qualquer
Basta ver o que não se enxerga
O que só se enxerga nos olhos de uma mulher
Basta olhar pro que acontece
Esteja onde estiver
[Refrão]
Pra entender
Pra entender
Nada disso é tudo, tudo isso é fundamental
[Verso 2]
Pra entender basta a cara e a coragem
A cor, o corpo, o coração (A cor, o corpo, o coração)
Uma canção da banda preferida
Uma descida ao porão (Não)
Seis pilhas pro meu rádio
Seis minutos pra canção
Basta olhar pro o que acontece
Aconteça o que acontecer
[Refrão]
Pra entender
Pra entender
Nada disso é tudo e tudo isso é fundamental
[Verso 3]
Pra entender basta uma noite de insônia
Um sonho que não tem fim
Um filme sem muita graça
Uma praça sem muito sol
Oh, seis cordas pra guitarra
Seis sentidos na mesma direção
Seiscentos anos de estudo
Ou seis segundos de atenção
[Refrão]
Pra entender
Pra entender
Nada disso é tudo e tudo isso é fundamental"
,"Pra Entender [Acústico Filmes de Guerra, Canções de Amor]","1 Contributor
Pra Entender [Acústico Filmes de Guerra, Canções de Amor] Lyrics
[Letra da versão acústica de ""Pra Entender""]
[Verso 1]
Pra entender basta um tapa num cigarro
Uma olhada no mapa do Brasil
Uma caminhada por qualquer caminho
Um carinho qualquer
Basta ver o que não se enxerga
E só se enxerga nos olhos de uma mulher
Basta olhar pro que acontece
Esteja onde estiver
[Refrão]
Pra entender
Pra entender
Nada disso é tudo e tudo isso é fundamental
[Verso 2]
Pra entender basta a cara e a coragem
A cor, o corpo, o coração (A cor, o corpo, o coração)
Uma canção da banda preferida
Uma descida ao porão
Seis pilhas pro meu rádio
Seis minutos pra canção
Basta olhar pro o que acontece
Aconteça o que acontecer
[Refrão]
Pra entender
Pra entender
Nada disso é tudo e tudo isso é fundamental
[Verso 3]
Pra entender basta uma noite de insônia
Um sonho que não tem fim
Um filme sem muita graça
Uma praça sem muito sol
Oh, seis cordas pra guitarra
Seis sentidos na mesma direção
Seiscentos anos de estudo
Ou seis segundos de atenção
[Refrão]
Pra entender
Pra entender
Nada disso é tudo e tudo isso é fundamental"
,Pra Ficar Legal,"1 Contributor
Pra Ficar Legal Lyrics
[Letra de ""Pra Ficar Legal""]
[Verso 1]
Agora não, ainda é cedo pra entender
Vou sair do ar um tempo
Na contramão do que está por acontecer
Vou respirar com paciência
[Pré-Refrão]
Sei que lá fora brilham luzes artificiais
Lá fora o fogo das caldeiras pede mais e mais
Querem sempre mais
[Refrão]
Louco pra ficar legal
Longe da euforia industrial
Louco pra ficar legal
Longe da histeria carnaval
[Verso 2]
Agora não, muito tarde pra entender
Eu tô fechado pra balanço
Na contramão de tudo que dizem que aconteceu
Eu vou sair da área de alcance
[Pré-Refrão]
Sei que lá fora a banda toca em outro tom
Lá fora ainda rimam soluções
Lá fora violência vende mais
[Refrão]
Louco pra ficar legal
Longe de um romance policial
Louco pra ficar legal
Longe, Porto Alegre, Rio, Nepal
[Saída]
Louco pra ficar em paz
Louco pra ficar legal"
,Pra Ser Sincero,"6 Contributors
Pra Ser Sincero Lyrics
Terceiro single d'O Papa é Pop, “Pra Ser Sincero” fala sobre um relacionamento complicado. A música, uma das mais famosas da banda, não é muito adorada por Humberto Gessinger:

Geralmente gosto mais das…
Read More
[Letra de ""Pra Ser Sincero""]
[Verso 1]
Pra ser sincero, eu não espero de você mais do que educação, beijos sem paixão
Crimes sem castigo, aperto de mãos, apenas bons amigos
Pra ser sincero, eu não quero que você minta
Não se sinta capaz de enganar quem não engana a si mesmo
[Refrão]
Nós dois temos os mesmos defeitos
Sabemos tudo a nosso respeito
Somos suspeitos de um crime perfeito
Mas crimes perfeitos não deixam suspeitos
[Verso 2]
Pra ser sincero, eu não espero de você mais do que educação, beijos sem paixão
Crimes sem castigo, aperto de mãos, apenas bons amigos
Pra ser sincero, não espero que você me perdoe
Por ter perdido a calma, por ter vendido a alma ao diabo
[Pré-Refrão]
Um dia desses, num desses encontros casuais
Talvez a gente se encontre, talvez a gente encontre explicação
Um dia desses, num desses encontros casuais
Talvez eu diga, ""Minha amiga, pra ser sincero, prazer em vê-la
Até mais""
[Refrão]
Nós dois temos os mesmos defeitos
Sabemos tudo a nosso respeito
Somos suspeitos de um crime perfeito
Mas crimes perfeitos não deixam suspeitos"
,"Pra Ser Sincero [Acústico Filmes de Guerra, Canções de Amor]","1 Contributor
Pra Ser Sincero [Acústico Filmes de Guerra, Canções de Amor] Lyrics
[Letra de ""Pra Ser Sincero""]
[Verso 1]
Pra ser sincero, eu não espero de você mais do que educação, beijos sem paixão
Crimes sem castigo, aperto de mãos, apenas bons amigos
Pra ser sincero, eu não quero que você minta
Não se sinta capaz de enganar quem não engana a si mesmo
[Refrão]
Nós dois temos os mesmos defeitos
Sabemos tudo a nosso respeito
Somos suspeitos de um crime perfeito
Mas crimes perfeitos não deixam suspeitos
[Verso 2]
Pra ser sincero, não espero de você mais do que educação, beijos sem paixão
Crimes sem castigo, aperto de mãos, apenas bons amigos
Pra ser sincero, eu não espero que você me perdoe
Por ter perdido a calma, por ter vendido a alma ao diabo
[Pré-Refrão]
Um dia desses, num desses encontros casuais
Talvez a gente se encontre, talvez a gente encontre explicação
Um dia desses, num desses encontros casuais
Talvez eu diga, ""Minha amiga, pra ser sincero, prazer em vê-la
Até mais""
[Refrão]
Nós dois temos os mesmos defeitos
Sabemos tudo a nosso respeito
Somos suspeitos de um crime perfeito
Mas crimes perfeitos não deixam suspeitos
Nós dois temos os mesmos defeitos
Sabemos tudo a nosso respeito
Somos suspeitos de um crime perfeito
Mas crimes perfeitos nunca deixam suspeitos"
,Pra Ser Sincero [Acústico Novos Horizontes],"1 Contributor
Pra Ser Sincero [Acústico Novos Horizontes] Lyrics
[Letra da versão acústica de ""Pra Ser Sincero""]
[Verso 1]
Pra ser sincero, eu não espero de você mais do que educação, beijos sem paixão
Crimes sem castigo, aperto de mãos, apenas bons amigos
Pra ser sincero, eu não quero que você minta
Não se sinta capaz de enganar quem não engana a si mesmo
[Refrão]
Nós dois temos os mesmos defeitos
Sabemos tudo a nosso respeito
Somos suspeitos de um crime perfeito
Mas crimes perfeitos não deixam suspeitos
[Verso 2]
Pra ser sincero, eu não espero de você mais do que educação, beijos sem paixão
Crimes sem castigo, aperto de mãos, ainda bons amigos
Pra ser sincero, não espero que você me perdoe
Por ter perdido a calma, por ter vendido a alma ao diabo
[Pré-Refrão]
Um dia desses, num desses encontros casuais
Talvez a gente se encontre, talvez a gente encontre explicação
Um dia desses, num desses encontros casuais
Talvez eu diga, ""Minha amiga, pra ser sincero, prazer em vê-la
Até mais""
[Refrão]
Nós dois (Temos os mesmos defeitos)
(Sabemos tudo a nosso respeito)
(Somos suspeitos de um crime perfeito)
(Mas crimes perfeitos não deixam suspeitos)"
,Pra Ser Sincero [Ao Vivo 10.000 Destinos],"1 Contributor
Pra Ser Sincero [Ao Vivo 10.000 Destinos] Lyrics
[Letra da versão ao vivo de ""Pra Ser Sincero""]
[Verso 1]
Pra ser sincero, eu não espero de você mais do que educação, beijos sem paixão
Crimes sem castigo, aperto de mãos, ainda bons amigos
Pra ser sincero, eu não quero que você minta
Não se sinta capaz de enganar quem não engana a si mesmo
[Refrão]
Nós dois temos os mesmos defeitos
Sabemos tudo a nosso respeito
Somos suspeitos de um crime perfeito
Mas crimes perfeitos não deixam suspeitos
[Verso 2]
Pra ser sincero, eu não espero de você mais do que educação, beijos sem paixão
Crimes sem castigo, aperto de mãos, ainda bons amigos
Pra ser sincero, não espero que você me perdoe
Por ter perdido a calma, por ter vendido a alma ao diabo
[Pré-Refrão]
Um dia desses, num desses encontros casuais
Talvez a gente se encontre, talvez a gente encontre explicação
Um dia desses, num desses encontros casuais
Talvez eu diga, ""Minha amiga, pra ser sincero, prazer em vê-la
Até mais""
[Refrão]
Nós dois (Temos os mesmos defeitos)
(Sabemos tudo a nosso respeito)
(Somos suspeitos de um crime perfeito)
(Mas crimes perfeitos não deixam suspeitos)"
,Problemas... Sempre Existiram,"2 Contributors
Problemas... Sempre Existiram Lyrics
Continuando “A Conquista do Espelho,” a melhor conclusão que se pode ter depois de tantos erros e decepções da música anterior é que problemas sempre existiram e sempre existirão.
[Letra de ""Problemas... Sempre Existiram""]
[Verso 1]
Não fui eu, não foi você
Nem foi a máquina de escrever
Que matou a poesia
Que matou a poesia
Não foram os Deuses, nem foi a morte de Deus
Não foi o jabá da academia
Que matou a poesia
Que matou a poesia
[Verso 2]
No fim de semana, o fim do planeta
A palavra ""Sarjeta"" no fim do poema
Problemas sempre existiram
Problemas sempre existiram
Esteróides anabolizantes, samplers, dicionários de rima
O medo do fim (Fim) no final das contas
Problemas sempre existiram
Problemas sempre existiram, sempre existirão
Sempre existiram, sempre existirão
[Refrão]
A última palavra é a mãe de todo o silêncio
Façamos silêncio para ouvir o último suspiro
Descanse em paz a mãe de todas as batalhas
A última palavra é a mãe de todo o silêncio
Descanse em paz, dê o último suspiro
Façamos silêncio para ouvir o último poema
[Ponte]
Por que você não soa quando toca?
Por que você não sua quando ama?
Ninguém derrama sangue quando perde
Guerras de fliperama
Por que você não sua quando toca?
Por que você não sua quando ama?
Por que você não soa quando toca?
Por que você não sua quando ama?
[Refrão]
As mentiras da arte são tantas
São plantas artificiais
Artifícios que usamos para sermos ou parecermos mais reais
Um pedaço do paraíso
Uma estação no inferno
Uma soma muito, muito, muito maior do que as partes
[Saída]
As mentiras da arte, o último poema"
,Quando o Carnaval Chegar,"1 Contributor
Quando o Carnaval Chegar Lyrics
[Letra de ""Quando o Carnaval Chegar""]
[Verso]
Quem me vê sempre parado, distante, garante que eu não sei sambar
Tô me guardando pra quando o carnaval chegar
Eu tô só vendo, sabendo, sentindo, escutando e não posso falar
Tô me guardando pra quando o carnaval chegar
Eu vejo as penas de louça da moça que passa e não posso pegar
Há quanto tempo desejo seu beijo molhado de maracujá
Tô me guardando pra quando o carnaval chegar
E que me ofende, humilhando, pisando, pensando que eu vou aturar
E quem me vê apanhando da vida duvida que eu vá revidar
Tô me guardando pra quando o carnaval chegar
Eu vejo a barra do dia surgindo, pedindo pra gente cantar
Eu tenho tanta alegria, adiada, abafada, quem dera gritar
Tô me guardando pra quando o carnaval chegar
Tô me guardando pra quando o carnaval chegar
Tô me guardando pra quando o carnaval chegar"
,Quanto Vale a Vida?,"1 Contributor
Quanto Vale a Vida? Lyrics
[Letra de ""Quanto Vale a Vida""]
[Verso 1]
Quanto vale a vida de qualquer um de nós?
Quanto vale a vida em qualquer situação?
Quanto valia a vida perdida sem razão?
Num beco sem saída, quando vale a vida?
São segredos que a gente não conta
São contas que a gente não faz
Quem souber quanto vale, fale em alto e bom som
[Verso 2]
Quantas vidas vale o tesouro nacional?
Quantas vidas cabem na foto do jornal?
Às sete da manhã, quanto vale a vida
Depois da meia-noite, antes de abrir o sinal?
São segredos que a gente não conta
E faz de conta que não quer nem saber
Quem souber, fale agora ou cale-se para sempre
[Verso 3]
Quanto vale a vida acima de qualquer suspeita?
Quanto vale a vida debaixo dos viadutos?
Quanto vale a vida perto do fim do mês?
Quanto vale a vida longe de quem nos faz viver?
São segredos que a gente não conta
São contas que a gente não faz
Coisas que o dinheiro não compra
Perguntas que a gente não faz, quanto vale a vida?
[Ponte]
Nas garras da águia, nas asas da pomba
Em poucas palavras, no silêncio total
No olho do furacão, na ilha da fantasia
Quanto vale a vida?
[Verso 4]
Quanto vale a vida na última cena
Quando todo mundo pode ser heróI?
Quanto vale a vida quando vale a pena?
Quanto vale quando dóI?
São coisas que o dinheiro não compra
Perguntas que a gente não faz:
Quanto vale a vida?
[Saída]
O que você me pede, eu não posso fazer
Assim você me perde e eu perco você
O que você não pode, eu não vou te pedir
O que você não quer, eu não quero insistir
Eu não quero insistir, eu não quero insistir
Toda vez que toca o telefone, eu penso que é você
Toda noite de insônia, eu penso em te escrever
Pra dizer que o teu silêncio me agride
E não me agrada ser um calendário do ano passado
Pra dizer que teu crime me cansa
E não compensa entrar na dança depois que a música parou
Depois que a música parou, depois que a música parou"
,Quartos de Hotel,"2 Contributors
Quartos de Hotel Lyrics
“Quartos de Hotel,” assim como “Piano Bar,” fala sobre a solidão da estrada, já esse álbum foi o primeiro escrito totalmente no Rio de Janeiro, longe da terra natal dos membros da banda, Porto Alegre.
[Letra de ""Quartos de Hotel""]
[Intro]
Tô num lugar comum onde qualquer um se esconde
Pra fazer a frase feita e sentir os efeitos colaterais
Tô em lugar nenhum (Onde?) Onde qualquer um se esconde
Pra fazer a frase feita, contrabando de uma seita oriental
Não tenho estado muito em casa ultimamente
Nem me lembro quanto tempo faz, aprendi a não olhar pra trás
[Verso 1]
Eu conto as horas que passam, eu conto estrelas no céu
Na solidão das noites sem graça, nos quartos de hotel
Como se chama essa cidade? Como se chama a atenção
De uma cidade que dorme, enquanto a gente, infelizmente, não
Bobeiras na noite, noites inteiras, pensando bobagens, bebendo besteiras
Sem companhia, sem companheira, nos quartos de hotel
[Refrão]
A cada cena as paredes mudam de cor no quarto quase escuro
À luz apenas do aparelho televisor, espelho retrovisor futuro
A duras penas eu apago a televisão, o quarto fica quase escuro
Iluminado apenas pela letra ""H"" da palavra ""Hotel"" escrita em neon
[Verso 2]
Amanhã, numa cidade diferente, não haverá diferenças no ar
As noites passarão do mesmo jeito, as estrelas estarão no mesmo lugar
Como se chama essa cidade? Como se chama a atenção
De uma cidade que morre enquanto a gente mente que não
Meias verdades, noites inteiras, bebendo bobagens, pensando besteiras
Sem entender o que sempre acontece nos quartos de hotel
[Refrão]
A cada cena as paredes mudam de cor no quarto quase escuro
À luz apenas do aparelho televisor, espelho retrovisor futuro
A duras penas eu apago a televisão, o quarto fica quase escuro
Iluminado apenas pela letra ""H"" da palavra ""Hotel"" escrita em neon
[Solo de Guitarra]
[Refrão]
A cada cena as paredes mudam de cor no quarto quase escuro
À luz apenas do aparelho televisor, espelho retrovisor futuro
A duras penas eu apago a televisão, o quarto fica quase escuro
Iluminado apenas pela letra ""H"" da palavra ""Hotel"" escrita em neon
Pra chamar a atenção de quem passa na rua
Contando as horas que passam
Contando estrelas no céu"
,Quebra-Cabeça,"1 Contributor
Quebra-Cabeça Lyrics
[Letra de ""Quebra-Cabeça""]
[Verso 1]
Pode ser pra sempre, pode não ser mais
Pode ter certeza e voltar atrás
Pode ser perfeito, fruto da imaginação
Pode ter defeito de fabricação
[Refrão]
Tá faltando peça no quebra-cabeça
Eu não tenho pressa, o meu tempo é todo teu
É tudo que eu posso oferecer,
é pouco
Mas é tudo que eu posso oferecer,
é quase nada
Mas é tudo que eu posso oferecer
[Verso 2]
Pode estar no ponto, ponto de interrogação
Pode ser encontro ou separação
Pode correr risco, arriscado sempre é
Só não pode o medo te paralisar
[Refrão]
Tá faltando peça no quebra-cabeça
Eu não tenho pressa, o meu tempo é todo teu
É tudo que eu posso oferecer,
é pouco
Mas é tudo que eu posso oferecer,
é quase nada
Mas é tudo que eu posso oferecer,
é pouco
Mas é tudo que eu tenho, tudo que eu posso oferecer
[Saída]
É pouco
Mas é tudo que eu posso oferecer,
é quase nada
Mas é tudo que eu posso oferecer,
é pouco
Mas é tudo que eu tenho, tudo que eu posso oferecer"
,Quem Diria,"1 Contributor
Quem Diria Lyrics
[Letra de ""Quem Diria""]
[Refrão]
Quem diria que um dia a gente iria chegar ao fim?
Quem diria que seria assim?
Ninguém seria capaz de adivinhar
Ninguém foi capaz de evitar
[Verso 1]
Você se enganou, tem que reconhecer
Não me conhecia e não sabia o que queria saber
Agora reclama sem nenhuma razão
Pra não dizer o que não quer ouvir ninguém falou
Você se enganou, não, não pode negar
Não me conhecia e não sabia, não sabia por quê
[Refrão]
Quem diria que um dia a gente iria chegar ao fim?
Quem diria que seria assim?
Ninguém seria capaz de adivinhar
Ninguém foi capaz de evitar
[Verso 2]
Você se assustou, foi fácil de perceber
Não sabia o que queria, não sabia o que queria saber
Agora reclama com toda razão
Pra não dizer o que não quer ouvir ninguém falou
Foi o que deveria ter sido se não fosse paixão
Se não fosse, se não fosse, se não, se não fosse paixão
[Refrão]
Quem diria que um dia a gente iria chegar ao fim?
Quem diria que seria assim?
Ninguém seria capaz de adivinhar
Ninguém foi capaz de evitar
[Solo de Guitara]
[Refrão]
Quem diria que um dia a gente iria chegar ao fim?
Quem diria que seria assim?
Ninguém seria capaz de adivinhar
Ninguém foi capaz de evitar"
,Quem Tem Pressa Não Se Interessa,"2 Contributors
Quem Tem Pressa Não Se Interessa Lyrics
[Letra de ""Quem Tem Pressa Não Se Interessa""]
[Intro: Humberto Gessinger]
Quando você me olha com seu olhar tranquilo
Sempre diz que falta algo, ou isto ou aquilo
Quando você me olha com seu olhar tranquilo
Sempre diz que falta algo, questões de estilo
[Verso: Humberto Gessinger]
Quando você me olha com seu olhar tranquilo
Sempre diz que falta algo, ou isto ou aquilo
Você não entende e se surpreende, seu olhar já não tá tranquilo
Mas quem tem pressa não se interessa por questões de estilo
Questões de estilo
As vozes oficiais dizem, ""Quem sabe,"" dizem, ""Talvez""
Enquanto os vídeos e as revistas mostram imagens sem nitidez
Você se espanta, há tanta coisa nos jornais
Mas quem tem pressa não se interessa em andar rápido demais
Rápido demais
Eles têm razão, mas a razão é só o que eles têm
A lâmina ilumina a mão, a lâmpada cria a escuridão
Há muita grana atrás de uma canção, ninguém se engana com uma canção
O tempo que nos gera também gera generais, mas o tempo nunca espera que cheguem os comerciais
Os comerciais, som
[Saída: Humberto Gessinger &
Carlos Maltz
]
Nas veias abertas da América, menina
Um mar vermelho de sangue leva navios piratas
Negociatas, concordatas, candidatos democratas
Sucos e sucatas, ternos e gravatas
Secando cataratas e lavando as mãos
Dando a impressão de que na areia movediça nada se desperdiça
Os comerciais, os comerciais
Os comerciais, os comerciais"
,Rádio Pirata,"2 Contributors
Rádio Pirata Lyrics
[Letra de ""Rádio Pirata""]
[Verso 1: Humberto Gessinger &
Paulo Ricardo
]
Abordar navios mercantes
Invadir, pilhar, tomar o que é nosso
Pirataria nas ondas do rádio
Havia alguma coisa errada com o rei
Preparar a nossa invasão
E fazer justiça com as próprias mãos
Dinamitar um paiol de bobagens
E navegar no mar da tranquilidade
[Refrão: Humberto Gessinger &
Paulo Ricardo
]
Toquem o meu coração
Façam a revolução
Está no ar nas ondas do rádio
No submundo, repousa o repúdio
Que deve despertar
[Verso 2: Humberto Gessinger &
Paulo Ricardo
]
Disputar em cada frequência
Um espaço nosso nessa decadência
Canções de guerra, quem sabe canções do mar
Canções de amor ao que vai vingar
[Refrão: Humberto Gessinger &
Paulo Ricardo
,
Ambos
]
Toquem o meu coração
Façam a revolução
Está no ar nas ondas do rádio
No submundo repousa o repúdio
Que deve despertar
[Refrão: Humberto Gessinger & Paulo Ricardo]
Toquem o meu coração
Façam a revolução
Toquem o meu coração
Façam a revolução"
